{
  "$schema": "https://json-schema.org/draft/2020-12/schema",
  "$id": "https://hydro-look.vercel.app/api/schema/adequacy.schema.json",
  "title": "adequacy.json",
  "description": "Expected national energy deficit in GWh/day at 7 to 90 days, the four-level risk tier, the ceilings it assumes and its backtest.",
  "type": "object",
  "required": [
    "schema_version",
    "generated_at",
    "data_date",
    "run_id",
    "origin_date",
    "model",
    "data",
    "assumptions",
    "current",
    "horizons",
    "tiers",
    "tier_history",
    "crisis_check",
    "license",
    "attribution",
    "see_also"
  ],
  "properties": {
    "schema_version": {
      "type": "integer",
      "const": 1,
      "description": "The format version. Changes only when a field is removed, renamed or retyped; added fields do not change it."
    },
    "generated_at": {
      "type": "string",
      "pattern": "^\\d{4}-\\d{2}-\\d{2}T\\d{2}:\\d{2}:\\d{2}(\\.\\d+)?Z$",
      "description": "When the document was written, UTC."
    },
    "data_date": {
      "type": [
        "string",
        "null"
      ],
      "pattern": "^\\d{4}-\\d{2}-\\d{2}$",
      "description": "The Ecuadorian calendar day the document's readings describe."
    },
    "run_id": {
      "type": "string"
    },
    "origin_date": {
      "type": "string",
      "pattern": "^\\d{4}-\\d{2}-\\d{2}$",
      "description": "The day the model stands on; equal to data_date."
    },
    "units": {
      "type": "string"
    },
    "disclaimer": {
      "type": "string"
    },
    "model": {
      "type": "object",
      "properties": {
        "id": {
          "type": "string"
        },
        "label": {
          "type": "string"
        },
        "backtest_origins": {
          "type": "integer"
        }
      },
      "required": [
        "id",
        "label",
        "backtest_origins"
      ]
    },
    "data": {
      "type": "object",
      "properties": {
        "usable_days": {
          "type": "integer"
        },
        "rejected_days": {
          "type": "integer"
        },
        "hydro_anomaly": {
          "type": "number"
        },
        "demand_growth_pct_per_year": {
          "type": "number"
        }
      },
      "required": [
        "usable_days",
        "rejected_days",
        "hydro_anomaly",
        "demand_growth_pct_per_year"
      ]
    },
    "assumptions": {
      "type": "object",
      "properties": {
        "thermal_gwh_day": {
          "type": "number"
        },
        "import_gwh_day": {
          "type": "number"
        },
        "stressed_import_gwh_day": {
          "type": "number"
        },
        "other_gwh_day": {
          "type": "number"
        },
        "editable_at": {
          "type": "string"
        }
      },
      "required": [
        "thermal_gwh_day",
        "import_gwh_day",
        "stressed_import_gwh_day",
        "other_gwh_day",
        "editable_at"
      ]
    },
    "current": {
      "type": "object",
      "properties": {
        "tier": {
          "type": "string",
          "enum": [
            "holgado",
            "vigilancia",
            "ajustado",
            "deficit"
          ],
          "description": "The model's Spanish word. Kept in schema_version 1; use the *_code field beside it."
        },
        "tier_code": {
          "type": "string",
          "enum": [
            "comfortable",
            "watch",
            "tight",
            "deficit"
          ]
        },
        "tier_label_es": {
          "type": "string"
        },
        "worst_tier": {
          "type": "string",
          "enum": [
            "holgado",
            "vigilancia",
            "ajustado",
            "deficit"
          ],
          "description": "The model's Spanish word. Kept in schema_version 1; use the *_code field beside it."
        },
        "worst_tier_code": {
          "type": "string",
          "enum": [
            "comfortable",
            "watch",
            "tight",
            "deficit"
          ]
        },
        "worst_tier_label_es": {
          "type": "string"
        },
        "worst_tier_horizon_days": {
          "type": "integer"
        },
        "worst_deficit_gwh_day": {
          "type": "number"
        },
        "narrative_tier_field": {
          "type": "string",
          "const": "worst_tier",
          "description": "Which of tier and worst_tier the daily narrative is written about."
        }
      },
      "required": [
        "tier",
        "tier_code",
        "tier_label_es",
        "worst_tier",
        "worst_tier_code",
        "worst_tier_label_es",
        "worst_tier_horizon_days",
        "worst_deficit_gwh_day",
        "narrative_tier_field"
      ]
    },
    "horizons": {
      "type": "array",
      "minItems": 1,
      "items": {
        "type": "object",
        "properties": {
          "horizon_days": {
            "type": "integer"
          },
          "target_date": {
            "type": "string",
            "pattern": "^\\d{4}-\\d{2}-\\d{2}$"
          },
          "demand_gwh_day": {
            "type": "number"
          },
          "hydro_gwh_day": {
            "type": "number"
          },
          "hydro_p10": {
            "type": [
              "number",
              "null"
            ]
          },
          "hydro_p90": {
            "type": [
              "number",
              "null"
            ]
          },
          "requirement_gwh_day": {
            "type": "number"
          },
          "deficit_gwh_day": {
            "type": "number"
          },
          "deficit_p10": {
            "type": [
              "number",
              "null"
            ]
          },
          "deficit_p90": {
            "type": [
              "number",
              "null"
            ]
          },
          "stressed_deficit_gwh_day": {
            "type": "number"
          },
          "margin_pct": {
            "type": "number"
          },
          "tier": {
            "type": "string",
            "enum": [
              "holgado",
              "vigilancia",
              "ajustado",
              "deficit"
            ],
            "description": "The model's Spanish word. Kept in schema_version 1; use the *_code field beside it."
          },
          "tier_code": {
            "type": "string",
            "enum": [
              "comfortable",
              "watch",
              "tight",
              "deficit"
            ]
          },
          "tier_label_es": {
            "type": "string"
          },
          "backtest": {
            "type": "object"
          }
        },
        "required": [
          "horizon_days",
          "target_date",
          "demand_gwh_day",
          "hydro_gwh_day",
          "hydro_p10",
          "hydro_p90",
          "requirement_gwh_day",
          "deficit_gwh_day",
          "deficit_p10",
          "deficit_p90",
          "stressed_deficit_gwh_day",
          "margin_pct",
          "tier",
          "tier_code",
          "tier_label_es",
          "backtest"
        ]
      }
    },
    "tiers": {
      "type": "object",
      "properties": {
        "definition": {
          "type": "object",
          "additionalProperties": {
            "type": "string"
          }
        },
        "codes": {
          "type": "object",
          "additionalProperties": {
            "type": "object",
            "properties": {
              "code": {
                "type": "string",
                "enum": [
                  "comfortable",
                  "watch",
                  "tight",
                  "deficit"
                ]
              },
              "label_es": {
                "type": "string"
              }
            },
            "required": [
              "code",
              "label_es"
            ]
          }
        }
      },
      "required": [
        "definition",
        "codes"
      ]
    },
    "tier_history": {
      "type": "object",
      "properties": {
        "horizon_days": {
          "type": "integer"
        },
        "origins": {
          "type": "integer"
        },
        "origins_followed_by_rationing": {
          "type": "integer"
        },
        "origins_flagged": {
          "type": "integer"
        },
        "share_of_flagged_that_preceded_cuts": {
          "type": [
            "number",
            "null"
          ]
        },
        "share_of_cuts_that_were_flagged": {
          "type": [
            "number",
            "null"
          ]
        }
      },
      "required": [
        "horizon_days",
        "origins",
        "origins_followed_by_rationing",
        "origins_flagged",
        "share_of_flagged_that_preceded_cuts",
        "share_of_cuts_that_were_flagged"
      ]
    },
    "crisis_check": {
      "type": "object",
      "properties": {
        "episodes": {
          "type": "array",
          "items": {
            "type": "object",
            "properties": {
              "start": {
                "type": "string",
                "pattern": "^\\d{4}-\\d{2}-\\d{2}$"
              },
              "end": {
                "type": "string",
                "pattern": "^\\d{4}-\\d{2}-\\d{2}$"
              },
              "days": {
                "type": "integer"
              },
              "measured_suppression_gwh_day": {
                "type": "number"
              },
              "implied_deficit_gwh_day": {
                "type": "number"
              }
            },
            "required": [
              "start",
              "end",
              "days",
              "measured_suppression_gwh_day",
              "implied_deficit_gwh_day"
            ]
          }
        }
      },
      "required": [
        "episodes"
      ]
    },
    "license": {
      "$ref": "#/$defs/license"
    },
    "attribution": {
      "$ref": "#/$defs/attribution"
    },
    "see_also": {
      "$ref": "#/$defs/see_also"
    }
  },
  "$defs": {
    "license": {
      "type": "object",
      "properties": {
        "code": {
          "type": "string",
          "const": "MIT"
        },
        "code_url": {
          "type": "string",
          "pattern": "^https?://"
        },
        "data": {
          "type": "string"
        },
        "data_es": {
          "type": "string"
        }
      },
      "required": [
        "code",
        "code_url",
        "data",
        "data_es"
      ]
    },
    "attribution": {
      "type": "array",
      "minItems": 1,
      "items": {
        "type": "object",
        "properties": {
          "id": {
            "type": "string"
          },
          "name": {
            "type": "string"
          },
          "provides": {
            "type": "string"
          },
          "url": {
            "type": "string",
            "pattern": "^https?://"
          },
          "terms": {
            "type": "string"
          }
        },
        "required": [
          "id",
          "name",
          "provides",
          "url",
          "terms"
        ]
      }
    },
    "see_also": {
      "type": "object",
      "required": [
        "schema",
        "documentation"
      ],
      "description": "Absolute URLs to the other documents, this document's schema and the documentation page.",
      "additionalProperties": {
        "type": "string",
        "pattern": "^https?://"
      }
    },
    "deprecated": {
      "type": "object",
      "additionalProperties": {
        "type": "string"
      },
      "description": "Fields kept for one more schema version, each with what replaces it."
    }
  }
}
